<!ELEMENT bookstore (book+) >
<!ELEMENT book (title, author, year , price, portada) >
<!ELEMENT title (#PCDATA) >
<!ELEMENT author (#PCDATA) >
<!ELEMENT year (#PCDATA) >
<!ELEMENT price (#PCDATA) >
<!ELEMENT portada (#PCDATA)>

<!ATTLIST book category CDATA #REQUIRED >
